{
  "version": "2.0.0",
  "intentions": [],
  "entities": [],
  "dialogs": [
    {
      "name": "onboarding",
      "actions": [
        {
          "text": "Some question",
          "action": "ask_for_input",
          "var_name": "response"
        },
        {
          "action": "send_text",
          "text": "The response is: {{$response}}"
        },
        {
          "text": "Some other question",
          "action": "ask_for_input",
          "var_name": "response",
          "can_switch_context": false
        }
      ]
    }
  ],
  "qa": []
}
