{
  "version": "2.0.0",
  "intentions": [],
  "entities": [],
  "dialogs": [
    {
      "name": "hola",
      "actions": [
        {
          "action": "set_var",
          "var_name": "name",
          "value": [
            "Max Power"
          ]
        },
        {
          "action": "set_var",
          "var_name": "nameAndAge",
          "value": [
            "Max Power",
            36
          ]
        },
        {
          "action": "set_var",
          "var_name": "height",
          "value": {
            "feets": 5,
            "inches": 7
          }
        },
        {
          "action": "set_var",
          "var_name": "nameAgeAndHeight",
          "value": [
            "Max Poser",
            36,
            "$height"
          ]
        }
      ]
    }
  ],
  "qa": []
}
