{
  "version": "2.0.0",
  "intentions": [],
  "entities": [],
  "commands": [
    {
      "keyword": "/help",
      "dialog": "entry_point_flow"
    }
  ],
  "dialogs": [
    {
      "name": "entry_point_flow",
      "actions": [
        {
          "action": "send_text",
          "text": "This is a test flow"
        }
      ]
    }
  ],
  "qa": []
}
