{
  "version": "2.0.0",
  "intentions": [],
  "entities": [],
  "dialogs": [
    {
      "name": "onboarding",
      "actions": [
        {
          "action": "wait_input",
          "var_name": "input",
          "can_switch_context": false
        },
        {
          "action": "send_text",
          "text": "You just said '{{$input}}'"
        }
      ]
    }
  ],
  "qa": []
}
