{
  "version": "2.0.0",
  "intentions": [],
  "entities": [],
  "dialogs": [
    {
      "name": "main",
      "actions": [
        {
          "buttons": [
            {
              "label": "Details",
              "payload": {
                "id": "{{$nerd_id}}"
              },
              "type": "postback"
            },
            {
              "label": "Something",
              "payload": "Any random text",
              "type": "postback"
            },
            {
              "label": "ping",
              "payload": "pong",
              "type": "message"
            },
            {
              "label": "More Details",
              "payload": "http://www.wizeline.com/profile",
              "type": "open_url"
            }
          ],
          "action": "send_menu"
        }
      ]
    },
    {
      "name": "other_menu",
      "actions": [
        {
          "buttons": [
            {
              "label": "Option1",
              "payload": {
                "option_id": "foo"
              },
              "type": "postback"
            },
            {
              "label": "Option2",
              "payload": {
                "option_id": "bar"
              },
              "type": "postback"
            }
          ],
          "text": "Please choice an option",
          "action": "send_menu"
        }
      ]
    }
  ],
  "qa": []
}
