{
  "version": "2.0.0",
  "intentions": [],
  "entities": [],
  "dialogs": [
    {
      "name": "onboarding",
      "actions": [
        {
          "action": "send_text",
          "text": "I'm sorry, I couldn't help you"
        },
        {
          "action": "set_var",
          "var_name": "market_id",
          "value": "MIAMI"
        },
        {
          "action": "handoff",
          "assignee": "$market_id"
        }
      ]
    }
  ],
  "qa": []
}
