{
  "version": "2.0.0",
  "intentions": [],
  "entities": [],
  "dialogs": [
    {
      "name": "subscriptions",
      "actions": [
        {
          "action": "subscribe_feed",
          "feed": "feed_name"
        },
        {
          "action": "unsubscribe_feed",
          "feed": "other_feed_name"
        }
      ]
    }
  ],
  "qa": []
}
