{
  "version": "2.0.0",
  "intentions": [],
  "entities": [],
  "dialogs": [
    {
      "name": "wait_for_entities",
      "actions": [
        {
          "action": "wait_input",
          "var_name": "response",
          "expect": {
            "fallback": "Did not get that",
            "entities": [
              "yes",
              "no",
              "other_entity"
            ]
          }
        },
        {
          "action": "send_text",
          "text": "response is: {{$response}}"
        }
      ]
    }
  ],
  "qa": []
}
