{
  "version": "2.0.0",
  "intentions": [],
  "entities": [],
  "dialogs": [
    {
      "name": "onboarding",
      "actions": [
        {
          "action": "ask_for_input",
          "text": "Some question",
          "var_name": "response",
          "quick_replies": [
            "Of course",
            "No way"
          ]
        }
      ]
    }
  ],
  "qa": []
}
