{
  "version": "2.0.0",
  "intentions": [],
  "entities": [],
  "dialogs": [
    {
      "name": "hola",
      "actions": [
        {
          "action": "set_var",
          "var_name": "nulo",
          "value": null
        },
        {
          "action": "set_var",
          "var_name": "nada",
          "value": {}
        },
        {
          "action": "set_var",
          "var_name": "persona",
          "value": {
            "name": "Max Power",
            "age": 36
          }
        },
        {
          "action": "send_text",
          "text": "My name is {{$persona.name}}, and I'm {{$persona.age}} years old"
        }
      ]
    }
  ],
  "qa": []
}
