{
  "version": "2.0.0",
  "intentions": [],
  "entities": [],
  "dialogs": [
    {
      "name": "main",
      "actions": [
        {
          "buttons": [
            {
              "type": "open_url",
              "label": "More Details",
              "payload": {
                "paramOne": 1,
                "url": "http://www.wizeline.com/profile"
              }
            }
          ],
          "action": "send_menu"
        }
      ]
    }
  ],
  "qa": []
}
